{
  "document": "run_record",
  "contract_version": "2.0",
  "stage": "liability_cashflow",
  "record_id": "record-2b7e9c41-8d3a-4f6e-a1c5-93d0e7b8f246",
  "procedure": {
    "type": "run"
  },
  "outcome": "succeeded",
  "recorded_at": "2026-10-03T09:00:00Z",
  "inputs": [
    {
      "role": "request",
      "artifact": {
        "path": "subset-run.request.json",
        "sha256": "22c212926caabdcae4420bfa6b56318adfdf262aa8082d329e0b7e80f683541a"
      }
    },
    {
      "role": "change_manifest",
      "artifact": {
        "path": "changes.json",
        "sha256": "987a69885e1d1f4f15f766b833c256b9066a7067c3c6d496fed61d6cdcf0a0da"
      }
    }
  ],
  "releases": [
    {
      "label": "N",
      "references": [
        {
          "kind": "input_data",
          "value": "model_points.csv",
          "artifact": {
            "path": "release/model_points.csv",
            "sha256": "7dfb54a154b5dcbedd09760c4de68942d15160461430942025d56a8a6e1fee3c"
          }
        },
        {
          "kind": "parameter_set",
          "value": "lapse_table.csv",
          "artifact": {
            "path": "release/lapse_table.csv",
            "sha256": "c681368d4183b28d61af7cbe9d8c3c0840f556307b13da5152bef379f708b606"
          }
        },
        {
          "kind": "parameter_set",
          "value": "parameters.csv",
          "artifact": {
            "path": "release/parameters.csv",
            "sha256": "3193e7f0cf6a6b3b4d30642a93d9bf8b682111f825358c8211dfa44a9548aa1b"
          }
        },
        {
          "kind": "code_state",
          "value": "projection.rules",
          "artifact": {
            "path": "release/projection.rules",
            "sha256": "bd7fe003be5e9b7eed088ecc2e747676e83e323acbf899e7a9419655f090031f"
          }
        },
        {
          "kind": "engine_version",
          "value": "engine build 2026.09"
        }
      ]
    }
  ],
  "parameters": [
    {
      "name": "acquisition_cost",
      "type": "scalar",
      "value": 500
    },
    {
      "name": "claim_expense",
      "type": "scalar",
      "value": 300
    },
    {
      "name": "collection_cost_rate",
      "type": "scalar",
      "value": 0.02
    },
    {
      "name": "lapse_table",
      "type": "keyed_table",
      "key_columns": [
        "policy_year"
      ],
      "value_columns": [
        "lapse_rate"
      ],
      "rows": [
        {
          "key": [
            1
          ],
          "values": [
            0.05
          ]
        },
        {
          "key": [
            2
          ],
          "values": [
            0.04
          ]
        },
        {
          "key": [
            3
          ],
          "values": [
            0.04
          ]
        },
        {
          "key": [
            4
          ],
          "values": [
            0.03
          ]
        }
      ]
    },
    {
      "name": "maintenance_cost",
      "type": "scalar",
      "value": 30
    },
    {
      "name": "mortality_basis",
      "type": "scalar",
      "value": "proxy_table_a"
    },
    {
      "name": "renewal_commission_rate",
      "type": "scalar",
      "value": 0.01
    },
    {
      "name": "surplus_share",
      "type": "scalar",
      "value": 0.9
    },
    {
      "name": "valuation_rate",
      "type": "scalar",
      "value": 0.01
    }
  ],
  "outputs": [
    {
      "role": "response",
      "artifact": {
        "path": "subset-run.response.json",
        "sha256": "2844b41b611ce598f158c61b6d2b3c99fd7db0c65e58ed9e398cb2eda23b7652"
      }
    },
    {
      "role": "export",
      "artifact": {
        "path": "subset-run.results.csv",
        "sha256": "dc9b989048cd5c55dad5db8ba0007a4a0a7a0ecb57e8a00cb5b4148fedd5c48b"
      }
    }
  ]
}
